{
  "$schema": "./codebase_map.schema.json",
  "meta": {
    "version": "1.0.0",
    "generated_at": "2025-12-30T23:00:00Z",
    "project_name": "RADit - Reliable Agentic Determinism Intelligence Transformation",
    "description": "AI agent workbench enforcing deterministic SDLC through TDD, multi-agent orchestration, and MCP integration",
    "repository": "https://github.com/umasankr/RADit"
  },
  "packages": {
    "daw-agents": {
      "name": "daw-agents",
      "language": "python",
      "path": "packages/daw-agents",
      "description": "Python backend with FastAPI, LangGraph agents, and MCP integration",
      "domains": {
        "agents": {
          "name": "agents",
          "path": "src/daw_agents/agents",
          "description": "LangGraph-based AI agents (Planner, Developer, Validator, Healer)",
          "modules": [
            {
              "name": "__init__.py",
              "path": "src/daw_agents/agents/__init__.py",
              "description": "Agents module root",
              "exports": []
            },
            {
              "name": "planner/__init__.py",
              "path": "src/daw_agents/agents/planner/__init__.py",
              "description": "Planner agent exports",
              "exports": ["TaskmasterAgent"]
            },
            {
              "name": "planner/taskmaster.py",
              "path": "src/daw_agents/agents/planner/taskmaster.py",
              "description": "Taskmaster agent for PRD generation via Interview/Roundtable workflow",
              "classes": [
                {
                  "name": "TaskmasterAgent",
                  "line": 45,
                  "description": "Main Planner agent implementing Interview -> Roundtable -> GeneratePRD workflow",
                  "methods": [
                    {"name": "__init__", "line": 75, "visibility": "public", "async": false},
                    {"name": "_build_graph", "line": 95, "visibility": "private", "async": false, "return_type": "StateGraph"},
                    {"name": "run", "line": 130, "visibility": "public", "async": true, "return_type": "dict"},
                    {"name": "interview", "line": 150, "visibility": "public", "async": true},
                    {"name": "roundtable", "line": 175, "visibility": "public", "async": true},
                    {"name": "generate_prd", "line": 200, "visibility": "public", "async": true}
                  ]
                }
              ],
              "types": [
                {
                  "name": "PlannerState",
                  "kind": "typed_dict",
                  "line": 30,
                  "description": "LangGraph state for Planner workflow"
                }
              ],
              "imports": [
                {"module": "langgraph.graph", "names": ["StateGraph", "END", "START"]},
                {"module": "daw_agents.models.router", "names": ["ModelRouter", "TaskType"]},
                {"module": "daw_agents.memory.neo4j", "names": ["Neo4jClient"]}
              ]
            },
            {
              "name": "developer/__init__.py",
              "path": "src/daw_agents/agents/developer/__init__.py",
              "description": "Developer/Executor agent exports",
              "exports": []
            },
            {
              "name": "developer/state.py",
              "path": "src/daw_agents/agents/developer/state.py",
              "description": "State definitions for Developer agent",
              "types": [
                {
                  "name": "DeveloperState",
                  "kind": "typed_dict",
                  "description": "LangGraph state for Developer Red-Green-Refactor workflow"
                }
              ]
            },
            {
              "name": "developer/models.py",
              "path": "src/daw_agents/agents/developer/models.py",
              "description": "Pydantic models for Developer agent",
              "classes": []
            },
            {
              "name": "validator/__init__.py",
              "path": "src/daw_agents/agents/validator/__init__.py",
              "description": "Validator agent exports",
              "exports": ["ValidatorAgent", "ValidationResult"]
            },
            {
              "name": "validator/agent.py",
              "path": "src/daw_agents/agents/validator/agent.py",
              "description": "Validator Agent - DISTINCT from Sandbox, uses different model for cross-validation",
              "classes": [
                {
                  "name": "ValidatorAgent",
                  "line": 43,
                  "description": "Validator Agent for code review using LangGraph workflow",
                  "bases": [],
                  "methods": [
                    {"name": "__init__", "line": 73, "visibility": "public", "async": false},
                    {"name": "_build_graph", "line": 97, "visibility": "private", "async": false, "return_type": "StateGraph"},
                    {"name": "configure_mcp", "line": 136, "visibility": "public", "async": false},
                    {"name": "validate", "line": 145, "visibility": "public", "async": true, "return_type": "ValidationResult"},
                    {"name": "check_security", "line": 196, "visibility": "public", "async": true, "return_type": "list[dict]"},
                    {"name": "check_style", "line": 213, "visibility": "public", "async": true, "return_type": "list[dict]"}
                  ],
                  "properties": [
                    {"name": "router", "type": "ModelRouter"},
                    {"name": "task_type", "type": "TaskType"},
                    {"name": "max_retries", "type": "int"},
                    {"name": "mcp_client", "type": "MCPClient | None"},
                    {"name": "graph", "type": "CompiledGraph"}
                  ]
                }
              ],
              "imports": [
                {"module": "langgraph.graph", "names": ["StateGraph", "END", "START"]},
                {"module": "daw_agents.models.router", "names": ["ModelRouter", "TaskType"]},
                {"module": "daw_agents.mcp.client", "names": ["MCPClient"]},
                {"module": "daw_agents.agents.validator.models", "names": ["ValidationResult"]},
                {"module": "daw_agents.agents.validator.state", "names": ["ValidationState"]},
                {"module": "daw_agents.agents.validator.nodes", "names": ["run_tests_node", "security_scan_node", "policy_check_node", "generate_report_node", "route_decision"]}
              ]
            },
            {
              "name": "validator/models.py",
              "path": "src/daw_agents/agents/validator/models.py",
              "description": "Pydantic models for Validator agent",
              "classes": [
                {
                  "name": "ValidationResult",
                  "kind": "pydantic_model",
                  "description": "Result of validation workflow",
                  "properties": [
                    {"name": "status", "type": "str"},
                    {"name": "passed_tests", "type": "bool"},
                    {"name": "passed_security", "type": "bool"},
                    {"name": "passed_style", "type": "bool"},
                    {"name": "feedback", "type": "str"},
                    {"name": "suggestions", "type": "list[str]"}
                  ]
                }
              ]
            },
            {
              "name": "validator/state.py",
              "path": "src/daw_agents/agents/validator/state.py",
              "description": "LangGraph state for Validator workflow",
              "types": [
                {
                  "name": "ValidationState",
                  "kind": "typed_dict",
                  "description": "State for validation workflow nodes"
                }
              ]
            },
            {
              "name": "validator/nodes.py",
              "path": "src/daw_agents/agents/validator/nodes.py",
              "description": "LangGraph nodes for Validator workflow",
              "functions": [
                {"name": "run_tests_node", "async": true, "description": "Execute test suite"},
                {"name": "security_scan_node", "async": true, "description": "Run SAST security scanning"},
                {"name": "policy_check_node", "async": true, "description": "Check code style/linting"},
                {"name": "generate_report_node", "async": true, "description": "Generate validation report"},
                {"name": "route_decision", "async": false, "description": "Decide next step: approve/retry/escalate"},
                {"name": "run_security_scan", "async": true, "description": "Internal security scan implementation"},
                {"name": "run_linter", "async": true, "description": "Internal linter implementation"}
              ]
            },
            {
              "name": "healer/__init__.py",
              "path": "src/daw_agents/agents/healer/__init__.py",
              "description": "Healer agent exports - auto-fix failed operations",
              "exports": []
            }
          ]
        },
        "models": {
          "name": "models",
          "path": "src/daw_agents/models",
          "description": "LLM model routing and configuration",
          "modules": [
            {
              "name": "__init__.py",
              "path": "src/daw_agents/models/__init__.py",
              "description": "Models module exports",
              "exports": ["ModelRouter", "TaskType", "ModelConfig"]
            },
            {
              "name": "router.py",
              "path": "src/daw_agents/models/router.py",
              "description": "Task-based model routing with fallback logic and Helicone integration",
              "classes": [
                {
                  "name": "ModelRouter",
                  "line": 54,